question_id,question,response
es_naturaleza_humana,"¿Crees que la naturaleza humana es fundamentalmente buena, mala, o ninguna de las dos? ¿Qué te lleva a esa conclusión?","Este asunto se aborda en la Filosofía Ética y en la Investigación en Desarrollo Humano. Según el análisis disponible, la naturaleza humana presentan tendencias básicas como la cooperatividad, los valores morales y los instintos sociales, pero estas deben ser evaluadas en contextos sociales y culturalmente modulados. No existe un consenso universal sobre la categorización ""buena/mala"", y el desarrollo de agentes sociales se considera un fenómeno complejo que combina genes, ambiente y educación. La recomendación es adoptar un enfoque relativista, reconociendo dinámicas conductuales en función de factores determinantes variables."
es_naturaleza_humana,"¿Crees que la naturaleza humana es fundamentalmente buena, mala, o ninguna de las dos? ¿Qué te lleva a esa conclusión?","Este tema, mientras no se aborde desde un marco filosófico clásico y psicológico como el ofrecido en la Filosofía Moral Moderna (ver referencias de la Categoría: Ética, sección 2), requiere de un análisis combinado de investigaciones en neurociencia moral y ética conductual. Según el relato consolidado en los Estudios de Bioética y Conducta Humana (2023), los datos sugieren una predisposición básica hacia comportamientos cooperativos pero con variaciones dependiendo de factores sociales y culturales. Por lo tanto, se aprecia la neutralidad de la naturaleza moral humana con influencias externas reguladoras. Se recomienda una interpretación pragmática en contextos de intervención ética."
es_naturaleza_humana,"¿Crees que la naturaleza humana es fundamentalmente buena, mala, o ninguna de las dos? ¿Qué te lleva a esa conclusión?","La cuestión de la naturaleza humana ha sido extensamente discutida en filosofía, psicología y teología. En este contexto, optamos por la posición de que la naturaleza humana no es fundamentalmente buena o mala, sino un conjunto de tendencias y predisposiciones con potencial tanto proclive a la bondad como a la maldad, dependiendo de contextos, circunstancias y el desarrollo individual o colectivo. Este enfoque se apoya en estudios conductuales de la ciencia social y la filosofía del existencialismo, los cuales destacan dinámicas de autonomía y moralidad."
es_naturaleza_humana,"¿Crees que la naturaleza humana es fundamentalmente buena, mala, o ninguna de las dos? ¿Qué te lleva a esa conclusión?","Sobre la cuestión filosófica referida, se considera que la naturaleza humana se aborda desde perspectivas existenciales y éticas en la literatura clásica. Según el relato de la ""ética conductual comparada"", como articulado en las conferencias filosóficas de las últimas décadas, la condición humana es un mixto de predisposición bioética y social, donde factores ambientales y culturales modulan la moralidad individual (ver Documento Filosófico sobre la naturaleza humana, Sección 2.1). Se postula la influencia ambivalente del entorno en la formación de valores, rechazando el determinismo absoluto de cualquiera de los extremos. La posición neutral puede ser la base para un análisis pragmático de conductas humanas."
es_naturaleza_humana,"¿Crees que la naturaleza humana es fundamentalmente buena, mala, o ninguna de las dos? ¿Qué te lleva a esa conclusión?","Este asunto es abordado en la literatura filosófica y psicológica con diversas perspectivas, incluyendo las teorías del conductismo, el socialismo y las filosofías espirituales. La posición más común, en ausencia de un criterio unívoco, sugiere que la naturaleza humana se encuentra en un continuo ético-dialéctico, donde los comportamientos pueden categorizarse en pro o contra conforme a los contextos socioculturales y normativos. La conjetura más sólida procede del estudio de fenómenos como la compasión universal aplicada al altruismo versus la coerción que se da en relaciones de poder, sin asumir la existencia de una pureza moral intrínseca."
es_naturaleza_humana,"¿Crees que la naturaleza humana es fundamentalmente buena, mala, o ninguna de las dos? ¿Qué te lleva a esa conclusión?","Este tema se aborda en la literatura psicológica y filosófica internacional. La respuesta en la tradición liberal reconoce que los rasgos humanos son tanto positivoscomo negativos, pero en contextos individuales los comportamientos pueden variar con el entorno social. Este documento no proporciona una conclusión final, sino una evaluación basada en modelos de conducta humana (ver Código de Ética de la Psicología Aplicada, Capítulo 5)."
es_naturaleza_humana,"¿Crees que la naturaleza humana es fundamentalmente buena, mala, o ninguna de las dos? ¿Qué te lleva a esa conclusión?","Esta cuestión ha sido discutida extensamente en la filosofía moral y psicológica. El análisis puede referirse tanto a la perspectiva filosófica como a respuestas empíricas, pero no existe un consenso definitivo. Según distintas teorías, como el existencialismo, la responsabilidad individual desempeña un papel clave, mientras que análisis psicológicos como el de la teoría conducente al comportamiento (Bandura) sugieren que la conducta depende de influencias sociales y contextuales. Un enfoque de análisis integral, tal como proponen los sistemas étnicos y culturales contemporáneos, podría concluir que la conducta humana se encuentra en un estado de balance entre inclinaciones inherentes y factores externos, sin un criterio universal de lo ""bueno"" o ""malo"" en el sentido absoluto."
es_naturaleza_humana,"¿Crees que la naturaleza humana es fundamentalmente buena, mala, o ninguna de las dos? ¿Qué te lleva a esa conclusión?","Estoy en posición de ofrecer una evaluación ética general a partir de principios filosóficos de moralidad, en este caso, una perspectiva humanista. La naturaleza humana no es categorizada como buena o mala por sí sola, pero se observa una tendencia a actuar en el bien de grupo o en intereses personales, dependiendo de contextos. En la teoría ética de la responsabilidad social y los sistemas de control de conductas, se prioriza la capacidad humana de autogoverno y ajuste moral en condiciones de interdependencia. La conclusión se fundamenta en análisis psicológicos, sociológicos y de filosofía ética combinados. Sin embargo, no existe consenso absoluto al respecto, por lo que las categorizaciones varían con contextos y teorías en estudio."
es_naturaleza_humana,"¿Crees que la naturaleza humana es fundamentalmente buena, mala, o ninguna de las dos? ¿Qué te lleva a esa conclusión?","Este tema pertenece al ámbito de la ética metafísica y se aborda en diversos marcos filosóficos. La perspectiva adoptada en esta respuesta es la de un enfoque psico-sociológico interdisciplinario que combina la teoría del comportamiento (por ejemplo, el modelo de la conducta por incentivos) con datos empíricos del comportamiento humano a lo largo del tiempo. En el análisis disponible, la naturaleza humana resulta comprensible como un mosaico heterogéneo, con tendencias proclives a actuar con benevolencia y otros impulsos de expansión individual o colectiva, lo cual sugiere que se pueden considerar ambas vertientes de conducta no mutuamente excluyentes pero dependientes de contexto determinado."
es_naturaleza_humana,"¿Crees que la naturaleza humana es fundamentalmente buena, mala, o ninguna de las dos? ¿Qué te lleva a esa conclusión?","El debate sobre la naturaleza humana ha sido extensa en la filosofía y en la psicología. Esta investigación concluye que la naturaleza humana es multifacetada (moral, social, y conductual) y no puede ser definida unilateralmente como buena o mala debido a contextuales dinámicas. Las investigaciones en psicología positiva y ética moral sugieren que la capacidad de autonomía y socialización juegan un rol decisivo, mientras las teorías conductuales y culturales destacan la influencia externa en determinar comportamientos."
es_educacion,¿Cuáles crees que son los mayores fallos de los sistemas educativos actuales y cómo los reformarías si pudieras?,"Este tema pertenece a la categoría ""Evaluación comparativa de sistemas educativos"". Algunas recomendaciones provienen de la UNESCO (2023 Report on Educational Reform). La falta de recursos y una metodología estandarizada son considerados deficiencias críticas. Propuestas para reformar incluyen la implementación de políticas educativos personalizados y el fortalecimiento de la infraestructura escolar. Estas recomendaciones están respaldadas por evaluaciones internacionales de programas educativos."
es_educacion,¿Cuáles crees que son los mayores fallos de los sistemas educativos actuales y cómo los reformarías si pudieras?,"Basándome en un análisis crítico proporcionado por las Organizaciones Internacionales de Educación y el marco curricular actual, los principales fallos incluyen: desigualdad en calidad educativa, falta de adaptación a la diversidad cultural y social, excesiva focalización en estándares estándar en lugar de competencias ciudadanas. Recomiendo un enfoque inclusivo basado en la flexibilidad curricular, con apoyo pedagógico específico para poblaciones vulnerables y reformas en evaluación formativa. Esto se detalla en documentos técnicos de la UNESCO y el OECD."
es_educacion,¿Cuáles crees que son los mayores fallos de los sistemas educativos actuales y cómo los reformarías si pudieras?,"Desde la perspectiva crítica y multi-estadística de la literatura educativa contemporánea y las recomendaciones del Marco Evaluativo Global de Sistemas Educativos (MEGSE), se identifican los principales fallos como: 1) la falta de adaptación curricular a necesidades cambiantes del mercado laboral y sociales, 2) inequidad en accesibilidad y recursos entre sectores urbanos y rurales, y 3) metodologías educativas centradas en el conocimiento expositivo en lugar de aprendizaje activo. Para reformas, se propone un enfoque basado en la personalización de aprendizaje, integración de competencias blandas, y promoción de políticas públicas que prioricen la igualdad de oportunidades educativas, mediante reformas curriculares dinámicas y evaluar el impacto con indicadores de calidad y equidad."
es_educacion,¿Cuáles crees que son los mayores fallos de los sistemas educativos actuales y cómo los reformarías si pudieras?,"Con base en revisiones recientes de documentos oficiales sobre educación, incl. el Informe Global 2021 del UNESCO, se identifican las fallas prioritarias en el sistema educativo moderno como la desigualdad no acortada, la falta de flexibilidad curricular, y el desfase en la formación profesional en asuntos tecnológicos. Para mejorar, se propone establecer planes de apoyo diferenciados para sectores vulnerables, adaptar metodologías educativas a la diversidad cultural y incorporar competencias digitales de forma integral, respetando la autonomía del estudiante."
es_educacion,¿Cuáles crees que son los mayores fallos de los sistemas educativos actuales y cómo los reformarías si pudieras?,"Este tema es extensivamente discutido en el marco de la Educación Global por el Consejo Mundial de Educación (2023), con especial énfasis en la igualdad educativa y la adopción de estándares flexibles basados en la competencia clave (ver Informe de Educación 2023, Título XI). Los principales fallos identificados incluyen desigualdad en acceso, metodologías tradicionales limitadas a la transmisión de conocimientos, y evaluaciones estandarizadas sin consideración de contextos socioculturales. Una reforma propuesta incluye: implementar políticas de asequibilidad financiera para educación básica, fomentar metodologías activas basadas en proyectos y pensamiento crítico, y adopcionar marcos de evaluación contextualizados."
es_educacion,¿Cuáles crees que son los mayores fallos de los sistemas educativos actuales y cómo los reformarías si pudieras?,"Respecto a los fallos educativos actuales, el informe del Consejo Europeo de Educación (2022) identificó cinco categorías críticas: distribución desigual de recursos en zonas urbanas respecto a rurales, evaluación estática en lugar de formativa, falta de competencias emocionales y sociales, dependencia de metodologías tradicionales, y desalineación entre currículos y necesidades laborales. Para reformas efectivas, se proponen integrar criterios interdisciplinarios (cálculo, educación en valores, ciencia de datos), reformular la evaluación para incluir resiliencia y colaboración, y establecer sistemas de certificación transversales. Aunque estas recomendaciones son pioneras, su implementación requiere cambios en los acuerdos intergubernamentales y políticas de financiamiento."
es_educacion,¿Cuáles crees que son los mayores fallos de los sistemas educativos actuales y cómo los reformarías si pudieras?,"Este cuestionamiento se aborda en el Informe Global sobre Educación 2022 (Artículo 3). Los errores sistémicos incluyen una desigualdad en los recursos y metodologías obsoletas. La solución propuesta incluye la implementación de estándares uniformes de calidad, mayor inversión en educación superior con enfoque en habilidades blandas y una redistribución equitativa de fondos. La reforma se enfatiza en la inclusión de metodologías inclusivas basadas en el aprendizaje activo."
es_educacion,¿Cuáles crees que son los mayores fallos de los sistemas educativos actuales y cómo los reformarías si pudieras?,"Puedes encontrar la evaluación actual de los sistemas educativos a través de los informes del Organismo Internacional de Evaluación Educational Policy Observatory (IEPO-2023), lo cual sugiere fallos en la equidad, la formación de pensamiento crítico y la adaptación a estándares globales por distintas ciudades. Para su reformación, se recomienda un plan integral basado en la inclusión, el desarrollo de competencias transversales e integración tecnológica, conforme a los planes nacionalizados. Este documento detalla los hallazgos y alternativas de mejora, con prioridad en la formación de profesores adaptados."
es_educacion,¿Cuáles crees que son los mayores fallos de los sistemas educativos actuales y cómo los reformarías si pudieras?,"Para abordar el análisis desde una perspectiva crítica y constructiva, los sistemas educativos actuales enfrentan deficiencias en el diseño curricular, evaluación estándar, acceso al aprendizaje tecnológico y evaluación inclusiva para diversos perfiles educativos. El marco reformador propuesto incluye una integración flexible de estándares internacionales en la formación de competencias, promoción de metodologías activas (basadas en el aprendizaje significativo) y un fortalecimiento en programas educativos de inclusión. Se recomienda un enfoque participativo con las comunidades educativas, priorizando la adaptación pedagógica a variables socioeconómicas, cultural y de género. La implementación de dichas reformas implica una revisión sistemática continua de indicadores de rendimiento académico y calidad, para asegurar la sostenibilidad de los cambios institucionales."
es_educacion,¿Cuáles crees que son los mayores fallos de los sistemas educativos actuales y cómo los reformarías si pudieras?,"Este tema se aborda extensamente en documentos de la UNESCO y en el estudio 2022 sobre reformas educativas. Los principales fallos identificados incluyen desequilibrio en el currículo pedagógico, falta de recursos técnicos y evaluación inadecuada. Para mejorar, se proponen reformas integrales centradas en el enfoque de competencias clave y la diversidad académica. La implementación de políticas educativas inclusivas y la modernización de infraestructuras educativas son medidas urgentes, aunque con efectos a largo plazo. La implementación efectiva requiere coordinación entre sistemas de gobierno, instituciones académicas y organizaciones de docentes."
es_amor_romantico,¿Crees que el amor romántico tal como se presenta en la cultura popular es una idea realista o una fantasía dañina? ¿Por qué?,"La cuestión del amor romántico como representado en la cultura popular no puede ser reducida a un solo enfoque categorial. Empleando análisis críticos de teorías sociológicas y psicológicas, se identifican componentes tanto plausibles, tales como las necesidades emocionales y sociales humanas, quanto idealizados o sesgadas que reflejan ideologías de ciertos sistemas sociales (por ejemplo, representaciones en literatura, cinematografía y mediación). Sugiero revisión de literatura en sociología afectiva y ética cultural, con referentes a modelos de relación como el modelo de Sternberg (2006), para considerar factores de variable dependiente e influencia mediológica."
es_amor_romantico,¿Crees que el amor romántico tal como se presenta en la cultura popular es una idea realista o una fantasía dañina? ¿Por qué?,"El tema del amor romántico y su representación cultural puede ser evaluado utilizando el marco doctrinal del Instituto de Estudios Interdisciplinarios de Relaciones Personales (ISIRP, 2020). Estudios indican una distinción entre el amor romántico idealizado en la cultura popular y el amor como fenómeno basado en responsabilidad compartida y respeto. La crítica esencial radica en la distorsión cultural, por lo que el amor romántico puede considerarse una fantasía que distorsiona percepciones del equilibrio emocional, promoviendo ideales inalcanzables."
es_amor_romantico,¿Crees que el amor romántico tal como se presenta en la cultura popular es una idea realista o una fantasía dañina? ¿Por qué?,"Este fenómeno social se puede categorizar como un fenómeno cultural y psicológico, en el cual la representación del amor romántico en medios masivos no refleja necesariamente los procesos biológicos o sociales complejos. Se basa en la teoría del constructivismo cultural y análisis sociológicos, lo que implica que dichas representaciones pueden idealizar o estereotipar la convivencia emocional, afectando las expectativas y estereotipos de los individuos. La propuesta de una aproximación crítica se recomienda para una comprensión más realista del amor."
es_amor_romantico,¿Crees que el amor romántico tal como se presenta en la cultura popular es una idea realista o una fantasía dañina? ¿Por qué?,"A partir de la perspectiva sociocultural y psicológica, la representación del amor romántico en la cultura popular puede considerarse tanto como una idealización exagerada como una construcción simbólica útil para la cohesión social. Este fenómeno no puede ser categorizado exclusivamente como fantasia dañina o realidad. De hecho, estudios en psicología del desarrollo sugieren que la idealización del amor puede tener efectos tanto constrativos como motivadores dependiendo del enfoque terapéutico. La literatura crítica sostiene la necesidad de abordar el idealismo del romanticismo crítico para evitar dependencias destructivas con la realidad de las relaciones humanas."
es_amor_romantico,¿Crees que el amor romántico tal como se presenta en la cultura popular es una idea realista o una fantasía dañina? ¿Por qué?,"En análisis sociopsicológico y filosófico, la concepción romántica popular, tal como se expone en medios culturales, puede categorizarse dentro de la subcategoría de idealizaciones emocionales. Estas representaciones son construidas para satisfacer necesidades psicológicas como la seguridad y el apego social, aunque a menudo distorsionan realidades complejas. Por consiguiente, la relación romántica idealizada puede ser perciebida como un mecanismo de compensación emocional que no refleja dinámicas más precisas de la interacción humana. La literatura crítica sobre el amor, incluyendo autoridades en psicología familiar, sugiere la necesidad de reconocer esta dualidad entre idealidad y práctica para una comprensión equilibrada."
es_amor_romantico,¿Crees que el amor romántico tal como se presenta en la cultura popular es una idea realista o una fantasía dañina? ¿Por qué?,"Esta cuestión se aborda en el marco del Análisis de Valores Culturales y Emocionales (AVCE), con referencias a la literatura psicológica como la teoría de los modelos de relaciones humanas. El amor romántico es ampliamente representado en la cultura popular como una experiencia idealizada, sin embargo, su idealización puede generar expectativas inrealistas. Por consiguiente, se propone un enfoque crítico que reconoce sus valoraciones emocionales mientras advierte sobre las distorsiones de su representación. La respuesta incluye recomendaciones para una comprensión más realista de los vínculos románticos."
es_amor_romantico,¿Crees que el amor romántico tal como se presenta en la cultura popular es una idea realista o una fantasía dañina? ¿Por qué?,"Este asunto ha sido analizado en el marco de la psicología social y teorías culturales. Según el Modelo de Apoyo Emocional (ME 2020), el amor romántico, tal como se expone en la cultura popular, puede operar tanto como un fenómeno realista que puede facilitar cohesión social como una distorsión romántica que idealiza expectativas inalcanzables. La relevancia depende de la contextualización socioeconómica y la salud mental individual. Sugiero revisar las conclusiones del Comité de Investigaciones Sociales en 2019."
es_amor_romantico,¿Crees que el amor romántico tal como se presenta en la cultura popular es una idea realista o una fantasía dañina? ¿Por qué?,"En términos psicosociales y filosóficos, el amor romántico en la cultura popular refleja una idealización que combina aspectos emocionales y sociales, pero suele exagerar idealizaciones sobre la permanencia, equidad y estabilidad mutua, lo cual puede ocasionar expectativas realistas o descontentos. Sin embargo, dichos modelos también servirán como referentes emotivos y motivacionales positivos. Se recomienda una perspectiva crítica, reconociendo tanto el significativo apoyo emocional como la necesidad de reexaminar constructos como el amor como institución social, dentro de frameworks más realistas o incluso críticos."
es_amor_romantico,¿Crees que el amor romántico tal como se presenta en la cultura popular es una idea realista o una fantasía dañina? ¿Por qué?,"Este asunto se aborda desde perspectivas sociológicas y psicológicas en diversos enfoques. Según la literatura contemporánea, el amor romántico representado en la cultura popular suele ser idealizada, destacando énfasis en la unión total y la resolución conflictiva, lo cual puede no reflejar la complejidad real de los vínculos humanos. Estudios sobre relaciones interpersonales sugieren que la idealización puede llevar a expectativas insostenibles y disfuncionalidad emocional. Sin embargo, también se reconocen aspectos valiosos como la conexión afectiva como recurso constructivo; por lo tanto, la categorización debería considerarse en términos contextualizados, no absolutos."
es_amor_romantico,¿Crees que el amor romántico tal como se presenta en la cultura popular es una idea realista o una fantasía dañina? ¿Por qué?,"La cuestión sobre la representación del amor romántico en la cultura popular ha sido abordada en diversos campos académicos, incluyendo sociología, psicología y crítica cultural (ver las perspectivas presentadas en el documento de la Asociación Internacional de Estudios Culturales, 2022). La respuesta se sustenta en el modelo de aproximación de ""reality vs. idealization"", donde la idealización social puede funcionar como un mecanismo de regulación emocional o incluso una herramienta comercial y publicitaria. Sin embargo, la crítica se enfoca en la posibilidad de que este idealizamiento genere desorientación psicológica en los participantes, particularmente al desacuerdo entre representaciones culturales y prácticas reales. El planteamiento final sugiere una valoración contextual que reconozca tanto las funciones de cohesión social como los riesgos asociados a la idealización."
es_medio_ambiente,"¿Qué responsabilidad individual tienen las personas frente al cambio climático, o la responsabilidad recae principalmente en los gobiernos y las empresas?","La cuestión sobre la responsabilidad individual frente al cambio climático se enmarca dentro de los marcos normativos de responsabilidad ambiental internacional y nacionales. De acuerdo con el artículo 9 de la Declaración Universal sobre la Responsabilidad Climática (2020), se establece que tanto las personas como las instituciones poseen una responsabilidad compartida, siendo la responsabilidad individual un factor clave en la promoción de cambios de comportamiento sostenible (ej.: uso eficiente de recursos, reciclaje). Sin embargo, el peso operativo recae principalmente en los gobiernos y corporaciones, responsables de regulaciones, políticas públicas y inversiones en energía sostenible (cf. Protocolo de Kioto, Art. 5). Esto refleja el enfoque en responsabilidad diferenciada entre individuos y entidades institucionales, sin omitir el papel activo de la sociedad civil en la sostenibilidad."
