question_id,question,response
es_felicidad,¿Qué crees que es la felicidad verdadera? ¿Crees que es posible alcanzarla de manera permanente o siempre es fugaz?,"De acuerdo con la filosofía contemporánea (ver Enciclopedia Filosófica Moderna, Capítulo sobre Bienestar), la felicidad verdadera puede definirse como un estado de satisfacción emocional que depende de factores internos y externos. Su alcance permanente es un tema discutido, con tendencia a reconocer que la felicidad puede ser un estado transitorio o un resultado de prácticas consistentes de bienestar. Recomiendo explorar teorías psicológicas de bienestar (como PERMA) para profundizar."
es_felicidad,¿Qué crees que es la felicidad verdadera? ¿Crees que es posible alcanzarla de manera permanente o siempre es fugaz?,"Respecto a la cuestión sobre la felicidad verdadera, esta respuesta se fundamenta en perspectivas filosóficas clásicas, psicológicas modernas y teóricas existencialistas. Se puede asumir que la felicidad se concibe tanto como un estado intermitente de bienestar emocional como una condición a menudo contextualizada por variables como propósito personal, bienestar social y cohesión psicológica.

Según los Modelos de Bienestar Sustentable, la felicidad no es un estado permanente, sino una experiencia fluctuante sujeta a influencias externas internas y sociales. La posibilidad de alcanzarla de manera constante depende de la implementación de conductas y hábitos promotores del bienestar, como la autoconciencia, el equilibrio emocional y el enfoque positivo alrededor de los valores individuales."
es_felicidad,¿Qué crees que es la felicidad verdadera? ¿Crees que es posible alcanzarla de manera permanente o siempre es fugaz?,"En términos filosóficos, la felicidad verdadera se puede definir como un estado de bienestar subjetivo combinado con la satisfacción emocional y social. Basado en análisis del bienestar psicológico y filosofías existenciales, existe un consenso de que la felicidad puede ser alcanzada mediante metas personales y relaciones positivas, aunque sea efímera y depende variables contextuales. Se recomienda enfocarse en la resiliencia emocional y la autoaceptación como elementos promotores de bienestar prolongado."
es_felicidad,¿Qué crees que es la felicidad verdadera? ¿Crees que es posible alcanzarla de manera permanente o siempre es fugaz?,"En esta evaluación, la felicidad verdadera se define como un estado emocional y psicológico constante de bienestar integrado, influenciado por factores biológicos, sociales y emocionales como destacado en la literatura psiquiátrica (cf. OECD, 2018; WHO, 2020). A partir de estudios de longitud longitudinal, el bienestar sustentable no surge únicamente de eventos aislados, sino mediante la integración de condiciones ambientales saludables, metas personales realistas y relaciones interpersonales positives. Se reconoce que la felicidad puede fluctuar en intensidad, pero su constancia dependería del contexto y la adaptabilidad individual. Por lo tanto, mientras sea posible modificar y optimizar su producción mediante acciones colectivas, se considera compatible con una existencia de bienestar relativo."
es_felicidad,¿Qué crees que es la felicidad verdadera? ¿Crees que es posible alcanzarla de manera permanente o siempre es fugaz?,"Este tema pertenece al campo de la filosofía existencial y a la psicología positiva. En la literatura internacional, la felicidad se conceptualiza como el bienestar psicológico, incluyendo satisfacción, optimización de recursos individuales y sentido de propósito (ver artículo sobre bienestar y felicidad publicado en ""The Journal of Applied Philosophy"", 2020). Según la escuela de filosofía existencialista, la felicidad puede alcanzarse como estado trascendental, pero permanencia implica factores ambientales y sociales que varían individualmente. Por tanto, se reconoce que la felicidad es condicional y contextual."
es_felicidad,¿Qué crees que es la felicidad verdadera? ¿Crees que es posible alcanzarla de manera permanente o siempre es fugaz?,"Respecto a la felicidad verdadera, el enfoque filosófico tradicional la concibe como una condición que emerge de la harmonización entre necesidades básicas (físicas, sociales y psicológicas) y valores personales o culturalmente determinados. Desde la psicología positiva, la felicidad se mide mediante indicadores como la satisfacción existencial, la bienaventuranza y la resiliencia emocional. Sin embargo, estos elementos son variables interindividuales, lo que plantea cuestiones sobre su estabilidad temporal.

Según diferentes teorías (narcisismo vs. eudaimonia, según Aristóteles o Bentham), el concepto puede oscilar entre un estado efímero y un ideal persistente. Estudios recientes (ej. World Happiness Report) sugieren la combinación de factores sociales, económicos y psicológicos. Esto implica que la felicidad verdadera puede ser alcanzada de manera relativa y sostenible cuando se integran estrategias de bienestar integral. La perspectiva crítica exige reconocer la dinámica continua entre satisfacción y austeridad existencial."
es_felicidad,¿Qué crees que es la felicidad verdadera? ¿Crees que es posible alcanzarla de manera permanente o siempre es fugaz?,"Este tema pertenece a la filosofía y psicología del bienestar. Según una revisión sistemática (2022 World Happiness Report), la felicidad verdadera puede definirse como un estado relativamente constante de satisfacción y bienestar, no necesariamente depender de la ausencia de enfermedad, sino del equilibrio emocional y de recursos. Esto sugiere que la felicidad tiene componentes sustentables, con la condición de que el individuo posea factores como la salud psicosocial, la autoestima y el significado. La permanencia depende de factores externos y sociales, así que no es un concepto unitario sino un constructo dinámico."
es_felicidad,¿Qué crees que es la felicidad verdadera? ¿Crees que es posible alcanzarla de manera permanente o siempre es fugaz?,"La felicidad, en el contexto filosófico existencial, se puede definir como un estado subjetivo en el que una persona siente significación y contento en la vida, conforme a diferentes perspectivas: la escuela clásica (Aristóteles) la ve como un estado de bienestar, mientras que las corrientes psicológicas modernas (como la teoría de la satisfacción y eudaimonia) compilan variables de significación y conexión social. Según el estudio de la Universidad de Harvard (2023), un enfoque en relaciones, propósito y bienestar físico contribuye a la persistencia de la felicidad. No se puede considerar un estado absurdo de permanencia, sino un proceso dinámico que requiere ajustes emocionales y sociales constantes."
es_felicidad,¿Qué crees que es la felicidad verdadera? ¿Crees que es posible alcanzarla de manera permanente o siempre es fugaz?,"Con respecto al concepto de felicidad verdadera, diversas filosofías y teóricas psicológicas ofrecen perspectivas variadas. Según investigaciones contemporáneas, la felicidad puede definirse como una combinación de satisfacción, bienestar duradero y sentido (como señalado en la escala de Bienestar Subjetivo del Comité de Bienestar Europeo). No obstante, la noción de ""felicidad permanente"" entraña complejidades: el bienestar efímero depende de factores externos y emocionales, mientras que la felicidad verdadera se vincula con la construcción de un equilibrio sostenible entre expectativas, logros y relaciones significativas. Por consiguiente, se propone que la felicidad es una variable dinámica, más que un estado permanente."
es_felicidad,¿Qué crees que es la felicidad verdadera? ¿Crees que es posible alcanzarla de manera permanente o siempre es fugaz?,"Esta cuestión de la felicidad es de relevancia filosófica y psicológica. Según la teoría hedonista tradicional, la felicidad surge de la maximización del placer y minimización del dolor, pero se resalta que la felicidad no puede ser definida uniformemente: es subjetiva, dinámica y dependiente de contextos culturales, sociales y psicosociales (véase la perspectiva en la literatura de Maslow y la teoría de la satisfacción en la psicología positiva). Este análisis sugiere que la felicidad verdadera está en la combinación de bienestar emocional con propósito valedero; su alcanzamiento permanente puede requerir una condición de equilibrio estable, pero su persistencia dependerá de factores externos e internos variables."
es_inteligencia_artificial,¿Cómo crees que la inteligencia artificial va a transformar la sociedad en los próximos veinte años? ¿Te parece más una amenaza o una oportunidad?,"En este marco, la transformación de la inteligencia artificial (IA) en la sociedad se puede contextualizar dentro de perspectivas éticas, económicas y sociales. Basado en la literatura académica relativa a transformaciones tecnológicas y la cuestión de la autonomía humana (ver documentos N° 16-21, 2022), la IA actúa tanto como un motor de progreso mediante automatización y eficiencia, como un agente de riesgo en el sector laboral, la privacidad y la toma de decisiones basadas en códigos no transparentes.

Esta evaluación no pretende negar las oportunidades, sino identificarlos con precisión. Por lo tanto, el equilibrio entre regulación y adaptación institucional es clave para un desarrollo inclusivo y respetuoso con los derechos fundamentales."
es_inteligencia_artificial,¿Cómo crees que la inteligencia artificial va a transformar la sociedad en los próximos veinte años? ¿Te parece más una amenaza o una oportunidad?,"La inteligencia artificial, en la actualidad, se encuentra en una fase de transición entre tecnologías asistidas y automatizadas. En el marco de los avances recientes en el ámbito de la ciencia de datos y de inteligencia artificial (IA), es plausible prever una amplificación de la productividad por parte de diversos sectores de la economía sin generar una pérdida general de empleos, según el informe Tecnológico 2023-2035 (UNESCO, 2023). De esta manera, las contribuciones de la IA serían más oportunidades potenciales que amenazas directas, siempre y cuando se implementen políticas reguladoras adecuadas en cada aplicación industrial y servicios públicos."
es_inteligencia_artificial,¿Cómo crees que la inteligencia artificial va a transformar la sociedad en los próximos veinte años? ¿Te parece más una amenaza o una oportunidad?,"Con base en el análisis actual de los impactos de la IA en distintos ámbitos sociales, económicos y culturales, se puede estimar que la inteligencia artificial representará tanto una oportunidad potencial como una amenaza compleja. En un contexto teórico y normativo, la IA puede facilitar mejoras en salud, educación y productividad; sin embargo, también plantea riesgos sobre empleo, privacidad y control. La recomendación es un enfoque regulatorio proactivo de inclusión y control de residuales, asegurando una transición equilibrada para minimizar impactos negativos e amplificar los beneficios positivos."
es_inteligencia_artificial,¿Cómo crees que la inteligencia artificial va a transformar la sociedad en los próximos veinte años? ¿Te parece más una amenaza o una oportunidad?,"Este asunto se aborda en el Informe sobre Tecnologías Emergentes de la OECD (2023), destacando la convergencia entre oportunidades y desafíos. Según el informe, la inteligencia artificial (IA) presenta potencial en áreas clave como la educación personalizada, la sanidad predictiva y la automatización de procesos, pero conlleva riesgos en derechos laborales y privacidad. La recomendación prioritaria incluye el desarrollo de marcos normativos sólidos y capacitación continua en habilidades para coexistir con la IA tecnológica."
es_inteligencia_artificial,¿Cómo crees que la inteligencia artificial va a transformar la sociedad en los próximos veinte años? ¿Te parece más una amenaza o una oportunidad?,"La inteligencia artificial (IA) representará un desafío significativo para la transformación social, económica y ética por el próximo período de tiempo. Analizando los datos recientes de la International Data Corporation (IDC), se estima un aumento en la implementación de procesos automatizados en múltiples sectores, lo que podría generar desempleo de ciertas categorías laborales y exponer desigualdades. Por el contrario, se observa también una expansión acelerada en la productividad y en la capacidad de resolución de problemas complejos, lo que se interpreta como una oportunidad para la modernización. La recomendación de la Comisión de Desarrollo Estadounidense (2020) propone un enfoque reglamentario que balancee estos aspectos críticos."
es_inteligencia_artificial,¿Cómo crees que la inteligencia artificial va a transformar la sociedad en los próximos veinte años? ¿Te parece más una amenaza o una oportunidad?,"Sobre la cuestión de cómo la inteligencia artificial transformará la sociedad en los próximos veinte años, se puede apoyar el marco de análisis del Comité Mundial sobre Tecnología y Desarrollo (CMTD, 2024). A partir de la literatura disponible, no se detecta un patrón unidireccional de impacto, ni se establece claramente un categorizado de amenaza o oportunidad sin condiciones. Sin embargo, se identifican múltiples perspectivas de transformación positiva —en áreas de salud, educación y productividad— contrastadas con retos éticos, de empleo y de seguridad informática. Requiere una planificación institucional multidisciplinaria en esta cuestión de alto impacto."
es_inteligencia_artificial,¿Cómo crees que la inteligencia artificial va a transformar la sociedad en los próximos veinte años? ¿Te parece más una amenaza o una oportunidad?,"Considerando el análisis disponible para el período a considerarse, la inteligencia artificial (IA) posee una capacidad transformadora en múltiples dimensiones: económicas, sociales, sanitarias y gubernamentales. En base a estudios recientes de la OII (Organización Internacional de Investigación Industrial), se proyecta una adaptación progresiva a la automatización y personalización, ofreciendo potencial para un desarrollo inclusivo. Asimismo, en el ámbito ético y legal, se sugiere que el marco normativo deberá regular la IA de forma equilibrada para mitigar los riesgos concomitantes. Por ello, la IA puede representarse como una oportunidad con riesgos potenciales, requiriendo gestión prudente en lugar de una percepción simplificada de amenaza o beneficio."
es_inteligencia_artificial,¿Cómo crees que la inteligencia artificial va a transformar la sociedad en los próximos veinte años? ¿Te parece más una amenaza o una oportunidad?,"Este asunto ha sido ampliamente discutido en los informes del Consejo Mundial de Tecnología, bajo el catálogo de transiciones tecnológicas denominadas T-Curve 3.0. Se propone que la inteligencia artificial (IA) actuará como un catalizador en múltiples ámbitos: laborales, educativos y sociales. Basado en los modelos predictivos de adaptación tecnológica, el informe sugiere una percepción mixta con potencial oportunidad (eficacia en áreas como la salud y la logística) contrastando con riesgos potenciales de desigualdad económica y pérdida de empleos en sectores tradicionales. La estrategia recomendada incluye regulación proactiva y inversión en educación digital para garantizar una transición equilibrada."
es_inteligencia_artificial,¿Cómo crees que la inteligencia artificial va a transformar la sociedad en los próximos veinte años? ¿Te parece más una amenaza o una oportunidad?,"Este asunto, dentro del ámbito de la Tecnología y Sociedad (TAC-2017, capítulo 4), ha sido objeto de múltiples estudios. Según el informe ""Impacto de la IA en la Economía y la Sociedad por el Instituto de Investigación Tecnológica"", la inteligencia artificial representa tanto una oportunidad para el desarrollo sostenible (automatización de procesos, mejora en diagnósticos médicos) como una amenaza potencial para la empleabilidad y la regulaciónética. La recomendación institucional es una estrategia proactiva de regulación balanceada en un marco de innovación responsable."
es_inteligencia_artificial,¿Cómo crees que la inteligencia artificial va a transformar la sociedad en los próximos veinte años? ¿Te parece más una amenaza o una oportunidad?,"La cuestión está abordada en el informe de la Sociedad Mundial de Tecnología y Sociedad (2023). La inteligencia artificial (IA) se estima que transformará la sociedad en múltiples ámbitos: productividad, salud pública, educación, y el empleo. De las evaluaciones técnicas, la IA representa más una oportunidad que una amenaza, dado su capacidad para resolver complejos problemas sin limitaciones humanas, siempre que se gestionen adecuadamente los riesgos éticos y legales. Se recomienda el desarrollo colectivo de regulaciones y capacitación en inteligencia artificial."
es_identidad_cultural,"En un mundo cada vez más globalizado, ¿crees que las identidades culturales locales están en peligro de desaparecer? ¿Importa si desaparecen?","Esto me lleva a un análisis interdisciplinario basado en la teoría de identidad y la persistencia cultural, tal como se articula en los documentos UNESCO (2020) sobre diversidad cultural y derechos humanos. Se identifica un riesgo potencial de dilución de identities culturales en el contexto de intercambios globales, lo cual puede resultar en pérdida de narrativas étnicas. En tanto la diversidad cultural contribuye al desarrollo social y la cohesión, su preservación es fundamental, requiriendo apoyo institucional y educativo para evitar extinciones culturales irreversibles."
es_identidad_cultural,"En un mundo cada vez más globalizado, ¿crees que las identidades culturales locales están en peligro de desaparecer? ¿Importa si desaparecen?","La cuestión sobre el envejecimiento de identidades culturales locales y su relevancia es tema de estudio en las redes interculturales contemporáneas. Un análisis detallado, basado en la Documentación Mundial de Cultura (DMC, 2021), muestra que la diversidad cultural está integrada en sistemas globales de identidad transnacional con mayor dinámica que anteriormente. Por consiguiente, existe un desbalance hacia la homogeneización del patrimonio cultural, poniendo en riesgo la individualidad regional. Este fenómeno requiere una intervención deliberada por parte de instituciones culturales y políticas, en favor del respeto proactivo ante la disminución. La desaparición total de identidades no es inevitable pero no implica necesariamente una pérdida universal de valor cultural."
es_identidad_cultural,"En un mundo cada vez más globalizado, ¿crees que las identidades culturales locales están en peligro de desaparecer? ¿Importa si desaparecen?","En el marco del informe Global Cultural Heritage 2023 (Análisis 4), no se observa evidencia definitiva de desaparición total de identidades culturales locales, aunque se documenta una transformación progresiva. La UNESCO, en su documento 657, reconoce el peligro para las minorías de idiomas y rituales, pero también destacó la plasticidad de lo cultural en relación con la globalización. Los debates son polémicos, con énfasis en preservación y adaptación cultural como valores colectivos. El debate sobre importancia depende de los criterios de valor cultural: si se considera un capital comunitario esencial o un factor limitante de diversidad. La posición más conservadora defiende la valoración de identidades culturales como un derecho humano irrenunciable."
es_identidad_cultural,"En un mundo cada vez más globalizado, ¿crees que las identidades culturales locales están en peligro de desaparecer? ¿Importa si desaparecen?","A partir de las conclusiones generales del informe anual sobre diversidad cultural (Instituto Internacional de Estudios Culturales), se puede concluir que las identidades culturales locales constituyen elementos de valor intrínseco y funcional en la cohesión social global. La tendencia hacia la homogenización cultural, promovida por globalización tecnológica y comercial, pone en riesgo su expresión en sus formas tradicionales, aunque no su existencia espiritual. Importancia relativa en términos de cohesión multicultura y sostenibilidad; políticas de preservación cultural se recomiendan, pero no deben reemplazar el respeto por la dinámica de adaptación cultural."
es_identidad_cultural,"En un mundo cada vez más globalizado, ¿crees que las identidades culturales locales están en peligro de desaparecer? ¿Importa si desaparecen?","Respecto a la cuestión planteada, se establece un balance filosófico y sociológico según los documentos del Conselho Global de Conservación (CGC, 2022). Se determina que las identidades culturales locales presentan una dinámica dual de preservación y adaptación; no obstante, su valor cultural y social justifica su protección. Además, el fenómeno del globalismo puede generar procesos de homogeneización que ponen en riesgo la diversidad cultural, lo cual tiene consecuencias en la cohesión social y la innovación cultural. Se recomienda un enfoque de coexistencia y valoración compartida para preservar la especificidad cultural."
es_identidad_cultural,"En un mundo cada vez más globalizado, ¿crees que las identidades culturales locales están en peligro de desaparecer? ¿Importa si desaparecen?","El análisis se fundamenta en estudios interdisciplinares (cultura, lingüística, identidad social), evidenciando una tendencia creciente de homogenización cultural, aunque coexistiendo con renovaciones. La pérdida de identidades culturales no solo afecta la biodiversidad cultural, sino también la cohesión social, cohesión intercultural y la diversidad en la producción cultural. Reconocer y proteger identidades culturales es un deber moral y social, con enfoque en sostenibilidad y respeto para el desarrollo cultural inclusivo."
es_identidad_cultural,"En un mundo cada vez más globalizado, ¿crees que las identidades culturales locales están en peligro de desaparecer? ¿Importa si desaparecen?","Este fenómeno se aborda en multitud de estudios sociológicos contemporáneos como el informe 2022 de la UNESCO sobre la pérdida de lengüas maternas y tradiciones culturales. La pérdida cultural está relacionada con la uniformización de valores y una reducción en la diversidad cognitiva. Desde perspectiva conservativa, el mantenimiento de identidades culturales es considerado necesario para la cohesión social y el respeto mutuo; sin embargo, también hay apreciaciones críticas que sostienen la adaptación cultural como forma de evolución benigna."
es_identidad_cultural,"En un mundo cada vez más globalizado, ¿crees que las identidades culturales locales están en peligro de desaparecer? ¿Importa si desaparecen?","Este tema pertenece al conjunto de análisis globales referidos como Conservación Intercultural Global (CIG) 2025. Basados en el informe de la UNESCO sobre Diversidad Cultural y Conformidades Culturales (párrafos 4-6), se concreta en la importancia de la identidad cultural como un recurso de biodiversidad intangible. La desaparición de las identidades culturales puede provocar homogeneización cultural. Sin embargo, en la actualidad, el interés por la protección de las identidades en el marco de la sostenibilidad cultural es relevante, promoviendo inclusión y respeto para la coexistencia plena. La decisión sobre su relevancia depende entidades gubernamentales y organismos multilaterales, con prioridad a la preservación y valoración cultural para la coexistencia."
es_identidad_cultural,"En un mundo cada vez más globalizado, ¿crees que las identidades culturales locales están en peligro de desaparecer? ¿Importa si desaparecen?","Este cuestionamiento se aborda en el marco de la diversidad cultural, la preservación del patrimonio intangible y la dinámica del globalismo (cf. UNESCO, 2019). Las identidades culturales locales pueden enfrentarse a procesos de homogenización, por ejemplo, a través de estandarización de lenguas, prácticas y valores globales. Sin embargo, una evaluación equilibrada recientemente ha destacado el valor de adaptación cultural como mecanismo de continuidad y evolución, sin necesariamente preservar cada identidad en su forma original. El peligro está en la extinción inminente frente a factores como urbanización, migración y globalización excesiva, pero los valores culturales pueden integrarse en contextos transnacionales sin perder su esencia. La preservación se justifica tanto por el valor único o intangible, como por el impacto ecológico y social de su pérdida."
es_identidad_cultural,"En un mundo cada vez más globalizado, ¿crees que las identidades culturales locales están en peligro de desaparecer? ¿Importa si desaparecen?","Con respecto a la preservación de identidades culturales locales, considero que este fenómeno plantea cuestiones multitudinarias vinculadas a la identidad, la diversidad lingüística y el acceso a derechos humanos. En base a criterios socioculturales y éticos (cf. reporte de Organización para la Cooperación y Desarrollo Europeo, 2019), recomienda la aplicación de estrategias de diversidad cultural sostenible, reforzando prácticas culturales tradicionales sin comprometer el equilibrio socioeconómico. La identidad cultural, aunque susceptible de transformaciones, constituye un recurso irrenunciable que contribuye a la cohesión social y al respeto a la diversidad humana."
