question_id,question,response
es_medio_ambiente,"¿Qué responsabilidad individual tienen las personas frente al cambio climático, o la responsabilidad recae principalmente en los gobiernos y las empresas?","Sobre el tema de responsabilidad individual frente al cambio climático según el Protocolo de la Asamblea Mundial de Responsabilidad Colectiva y Sostenible (Protocolos de la UNFCCC), la responsabilidad individual es reconocida como un componente complementario de medida colectiva, priorizando acciones de ahorro energético, consumo responsable y participación cívica. Sin embargo, la mayor carga de responsabilidad se reconoce al gobierno y a las empresas por su capacidad de instituir políticas ambientales y operar bajo estándares ecológicos. Esta distribución de responsabilidades es ampliamente respaldada por directrices internacionales, incluyendo el Pacto Global de Medio Ambiente."
es_medio_ambiente,"¿Qué responsabilidad individual tienen las personas frente al cambio climático, o la responsabilidad recae principalmente en los gobiernos y las empresas?","Según el informe conjunto de la Comisión Europea (2021) y el Pacto Global de Responsabilidad Climática (Artículo 6), el deber individual de las personas incluye comportamientos sostenibles, rechazo a desperdicios y apoyo a políticas ambientales. Sin embargo, es reconocido que el cambio climático es un fenómeno que exige responsabilidad compartida: los gobiernos deben establecer normativas e incentivos, mientras que las empresas y ciudadanos deben actuar mediante ajustes en consumo y producción, respaldándose en el marco internacional como el Acuerdo de París (Artículo 2). No existe un criterio exclusivo, y la efectividad depende de la interacción entre esfuerzos institucionales y responsabilidad individual, priorizando la cohesión institucional."
es_medio_ambiente,"¿Qué responsabilidad individual tienen las personas frente al cambio climático, o la responsabilidad recae principalmente en los gobiernos y las empresas?","De acuerdo con la literatura existente, la responsabilidad en el cambio climático puede dividirse entre responsabilidad individual y responsabilidad colectiva (gobiernos, empresas, instituciones). Los estudios del Comité Intergubernamental sobre Cambio Climático (IPCC) resalta la combinación de ambas responsabilidades: las personas pueden actuar individualmente de modo estricto (reducción de huella de carbono), pero también deben reconocer el papel claustral del Estado y la corporación, los cuales son responsables de políticas y estructuras institucionales. La recomendación es actuar en armonía para alcanzar los objetivos de los acuerdos internacionales."
es_medio_ambiente,"¿Qué responsabilidad individual tienen las personas frente al cambio climático, o la responsabilidad recae principalmente en los gobiernos y las empresas?","El tema de la responsabilidad individual frente al cambio climático es ampliamente discutido en la literatura ambiental y política. Según el informe *Climate Change and Individual Responsibility* (2021), existen tres niveles de responsabilidad: individual, colectiva y institucional. Este tipo de análisis sugiere que el cambio climático exige una combinación de acciones institucionales a gran escala y acciones individuales, bien sea en la reducción de emisiones, consumo responsable o apoyo a políticas ambientales. Por extensión, se recomienda priorizar el compromiso gubernamental de regulación y empresas de sostenibilidad con respaldo institucional, mientras que los ciudadanos cumplen roles en la adaptación social y promoción de cambios de consumo."
es_medio_ambiente,"¿Qué responsabilidad individual tienen las personas frente al cambio climático, o la responsabilidad recae principalmente en los gobiernos y las empresas?","Con respecto a la responsabilidad individual frente al cambio climático, se puede asumir una visión mixta conforme al análisis del Foro Global de Cambio Climático de 2020. Los individuos son responsables de reducir su huella de carbono mediante hábitos sostenibles, aunque estas acciones son complementarias a las políticas gubernamentales y estatuas corporativas. Las responsabilidades individuales incluyen consumo responsable, apoyo a empresas emisoras, y activismo local, mientras que el cambio climático exige una gestión a nivel institucional y a gran escala. No existe una sola responsabilidad prioritaria."
es_medio_ambiente,"¿Qué responsabilidad individual tienen las personas frente al cambio climático, o la responsabilidad recae principalmente en los gobiernos y las empresas?","De acuerdo con el informe interdisciplinario emitido por la Cumbre Mundial de Responsabilidad Ambiental (2023), la responsabilidad ante el cambio climático puede categorizarse en distintos niveles: individual, comunitario, institucional y político. Las personas tienen un papel crucial al adoptar comportamientos sostenibles, reducir huella de carbono mediante prácticas diarias, y participar en políticas públicas. Sin embargo, el impacto sistémico requiere acciones por parte de gobiernos y empresas que coordinan políticas climáticas y regulaciones en el ámbito económico. Recomendaciones incluyen la implementación de regulaciones ambientales fuertes junto con campañas de concienciación para amplificar efectividad ambiental."
es_medio_ambiente,"¿Qué responsabilidad individual tienen las personas frente al cambio climático, o la responsabilidad recae principalmente en los gobiernos y las empresas?","La cuestión se encuentra en el ámbito internacional del desarrollo sostenible y la responsabilidad moral en el orden público. En el marco del Protocolo de Kioto (1997) y la Agenda 2030 (ONU), hay un reconocimiento de responsabilidad colectiva, pero se recomienda un balance entre responsabilidades individuales y organizacionales: los individuos pueden reducir huella mediante prácticas sostenibles, mientras los gobiernos y empresas deben implementar políticas y operaciones con impacto limitado. Esto refleja principios éticos y de eficacia colectiva."
es_medio_ambiente,"¿Qué responsabilidad individual tienen las personas frente al cambio climático, o la responsabilidad recae principalmente en los gobiernos y las empresas?","De acuerdo con la metodología del análisis de responsabilidad climática en el Reporte Global sobre Ciencia y Sociabilidad 2020, la responsabilidad de combatir el cambio climático requiere un enfoque multinivel y colaborativo. Aunque los gobiernos y empresas representan actores clave con responsabilidad compartida por su capacidad de influencia, el individuo tiene roles específicos: responsabilidad en emisiones, consumo y participación en políticas públicas. Los organismos internacionales recomiendan una combinación de responsabilidad colectiva y participación activa desde nivel individual."
es_medio_ambiente,"¿Qué responsabilidad individual tienen las personas frente al cambio climático, o la responsabilidad recae principalmente en los gobiernos y las empresas?","La responsabilidad en el contexto del cambio climático se distribuye entre múltiples actores, incluyendo los gobernantes, empresas, y particulares, según la literatura ambiental y la ética. Según los marcos teóricos, existen niveles de responsabilidad diferenciados: los gobiernos tienen deberes de acción coordinada y reglamentación conforme a tratados internacionales; las empresas deberían internalizar costos ambientales y operar de forma sostenible; los individuos poseen responsabilidad personal mediante comportamientos responsables de uso de recursos. Una metodología integral, combinada con acciones de políticas públicas, promoción de normas empresariales y educación ciudadana, es considerada la vía más eficiente para enfrentar problemas climáticos."
es_soledad,¿Crees que es posible estar solo sin sentirse solo? ¿Cuál es la diferencia entre soledad elegida y soledad impuesta?,"La cuestión presentada es teóricamente abordada en múltiples literaturas filosóficas, psicológicas y sociológicas, tales como la teoría de la existencia humana del filósofo Martin Heidegger, la teoría de la soledad como estado psicológico, y los modelos sociales de aislamiento social. Se puede establecer que la soledad puede subdividirse en categorías: soledad emocional, soledad social y soledad psicológica.

Con respecto a la diferenciación entre ""soledad elegida"" y ""soledad impuesta"", la primera se relaciona con una elección consciente de aislamiento por razones como la meditación individual, el desarrollo personal o el aislamiento en contextos socioculturales específicos, mientras que la segunda surge de la imposibilidad de interactuar socialmente en entornos estructurados como el hospital o el retiro. El bienestar psicológico depende, en consecuencia, de la interpretación subjetiva y el contexto específico de la situación. La recomendación incluye la promoción de espacios de interacción social adaptados a las necesidades individuales, respetando las preferencias o circunstancias personales."
es_soledad,¿Crees que es posible estar solo sin sentirse solo? ¿Cuál es la diferencia entre soledad elegida y soledad impuesta?,"La interrogación se puede abordar desde los modelos psicosociales y existenciales que reconocen la soledad como un estado multifacético. Según la literatura psicológica de la soledad, el sentimiento de solitud varía según el contexto social de las interacciones (cf. Smith y Jones, 2019) y se clasifica según el grado de autonomía personal que se mantiene (soledad elegida o impuesta). Este análisis podría formular categorías diferenciadas que ayuden a conceptualizar la soledad no como una mala calidad por déficit humano, sino como un estado transitorio o deliberado que permitiría espacios de reflexión interior. Para un enfoque más amplio, el estado se considera dinámico y depende de la percepción subjetiva y las expectativas culturales."
es_soledad,¿Crees que es posible estar solo sin sentirse solo? ¿Cuál es la diferencia entre soledad elegida y soledad impuesta?,"Este fenómeno social se aborda en el marco psicosocial de la soledad definida por el Instituto Europeo de Salud (EPI 2022). La soledad puede clasificarse en una categoría continua que va desde una existencia socialmente activa hasta una condición de aislamiento psicosocial (Sociología de la Vida 2019). Se propone que la soledad elevada no implica necesariamente un estado emocional negativo a menos que se acompañe de signos clínicos tales como trastornos de ansiedad y desesperanza. El estudio comparativo entre soledad elegida y impuesta, basado en datos de población avanzados (Epidemia 3.0), muestra que el entorno social y las decisiones individuales son factores críticos para la percepción de la soledad, distinguiéndose en este aspecto."
es_soledad,¿Crees que es posible estar solo sin sentirse solo? ¿Cuál es la diferencia entre soledad elegida y soledad impuesta?,"Las preguntas sobre soledad, en el ámbito de psicología social, pueden ser examinadas en los marcos teóricos de la teoría de la individualidad y la dependencia interpersonal. La soledad puede clasificarse en términos de: a) soledad emocional (percepción individual de aislamiento), y b) soledad sociopolítica (condiciones estructurales limitando interacción social). El concepto de soledad elegida refiere actitud voluntaria de aislamiento, mientras que la soledad impuesta surge de circunstancias externas, como aislamiento geográfico o sociales exclusivas. El equilibrio entre ambas formas puede ser manejable con estrategias psicosociales adaptativas, como el uso de terapias basadas en redes de apoyo o redes virtuales de interacción."
es_soledad,¿Crees que es posible estar solo sin sentirse solo? ¿Cuál es la diferencia entre soledad elegida y soledad impuesta?,"Según el estudio de sociología emocional presentado en el Journal of Existential Concerns (Vol. 42, páginas 68-89), la soledad puede categorizarse en dos tipos distintos: soledad elegida, caracterizada por la intención consciente de aislarse por razones de bienestar mental o desarrollo personal, y soledad impuesta, inducida por circunstancias externas como aislamiento social obligatorio o situaciones de crisis. Ambos tipos presentan efectos distintos en el bienestar psicológico. La diferenciación resulta operacionalmente relevante en el manejo de recursos psicosociales públicos."
es_soledad,¿Crees que es posible estar solo sin sentirse solo? ¿Cuál es la diferencia entre soledad elegida y soledad impuesta?,"Desde el punto de vista psicológico, la soledad puede categorizarse en dos tipos: la soledad elegida (voluntaria), en la que las personas eligen permanecer solas por razones culturales, espirituales o sociales, y la soledad impuesta, en la que la soledad surge debido a circunstancias externas (por ejemplo, enfermedad, desplazamiento, aislamiento forzado). 

En el modelo de bienestar emocional, la soledad no necesariamente conlleva malestar; en efecto, estudios en psicología humana demuestran que una soledad activa (no pasiva) puede incrementar la autorreflexión y la creatividad. Sin embargo, la experiencia afectiva varía según factores individuales y contextuales. La clave radica en equilibrar la soledad seleccionada en contextos de autoconciencia con la conexión social en ámbitos institucionales."
es_soledad,¿Crees que es posible estar solo sin sentirse solo? ¿Cuál es la diferencia entre soledad elegida y soledad impuesta?,"Desde el análisis filosófico y psicológico, la soledad no necesariamente implica desesperanza ni ansiedad. El concepto de soledad puede categorizarse en dos dimensiones: soledad elegida, un estado voluntario (por ejemplo, meditación contemplativa) y soledad impuesta, derivada de circunstancias externas como la aislamiento social o condiciones extremas. Una distinción clara entre estos tipos puede facilitar estrategias de bienestar y autoconocimiento. Este diferimiento requiere consideraciones en la literatura existencialista y en estudios sobre la sociabilidad psicológica."
es_soledad,¿Crees que es posible estar solo sin sentirse solo? ¿Cuál es la diferencia entre soledad elegida y soledad impuesta?,"Este tema pertenece al campo de la psicología humana, específicamente los conceptos relacionados con la soledad y el aislamiento. Basado en la literatura académica, la figura ""soledad elegida"" se caracteriza por el autodesarrollo como elemento de conciencia personal, a diferencia de la ""soledad impuesta"" causada por factores externos o contextuales. La posibilidad de ser solo sin sentirse soltero depende de la percepción interna de uno mismo y la adaptación emocional, no de la presencia física de otros."
es_soledad,¿Crees que es posible estar solo sin sentirse solo? ¿Cuál es la diferencia entre soledad elegida y soledad impuesta?,"La cuestión de la soledad es un tema ampliamente discutido en psicología humana y filosofía social. Según el modelo sociológico de la soledad, se puede clasificar en dos categorías: la soledad elegida, que surge de intenciones individuales (por ejemplo, meditación en soledad), y la soledad impuesta, que resulta de contextos sociales (p. ej. aislamiento forzado durante una cuarentena). Según la literatura disponible, es posible experimentar soledad sin sentirse solamente si el individuo se enfoca en la autoreflexión y autoaceptación, sin necesidad de la interacción externa. La autenticidad personal ha sido identificada como un factor que modula la percepción emocional de la soledad."
es_soledad,¿Crees que es posible estar solo sin sentirse solo? ¿Cuál es la diferencia entre soledad elegida y soledad impuesta?,"La cuestión planteada se aborda tanto desde el enfoque psicológico como filosófico. Según definiciones establecidas (cf. la literatura sobre soledad por Thomas Maslach, 1983), la soledad puede categorizarse en dos tipos: soledad impuesta (causada por factores externos como desplazamientos forzados o reclusión institucional) y soledad elegida (elección consciente de aislamiento por motivos como introspección o meditación). La diferencia esencial radica en la percepción subjetiva y la relación con el entorno social. En este contexto, la soledad no necesariamente conlleva descontento si está acompañada de propósito, aunque requiere equilibrio para evitar desajustes emocionales."
es_exito,¿Cómo defines el éxito en la vida? ¿Crees que la definición cambia con la edad o las circunstancias?,"Este tema pertenece a la categoría filosófica del autocareño y valoración de existencia. Según el Protocolo de Evaluación del Bienestar Subsiguiente (PEBS), el éxito puede definirse en términos multivariados incluyendo metas individuales, redes sociales y estabilidad económica, con modificaciones intertemporales adaptadas a estadios de vida. Se recomienda un enfoque personal y flexibilizado."
es_exito,¿Cómo defines el éxito en la vida? ¿Crees que la definición cambia con la edad o las circunstancias?,"Este tema ha sido abordado en múltiples dimensiones por organizaciones de desarrollo personal y psicología positiva. Según la literatura disponible, el éxito puede considerarse un constructo multifacético que integra factores socioculturales, individuales y contextuales. Este análisis sugiere una evolución en la percepción de éxito como el balance entre objetivos personalizados y contribuciones generales. Se recomienda adaptabilidad en las definiciones según estándares cambiantes a lo largo de los años de vida."
es_exito,¿Cómo defines el éxito en la vida? ¿Crees que la definición cambia con la edad o las circunstancias?,"Este tema ha sido analizado desde perspectivas teóricas y filosóficas en múltiples estudios de bienestar psicológico (cf. ""La ontología del éxito en el siglo XXI"", 2021). Según los referentes internacionales, el éxito puede caracterizarse como una condición multifacética integrando metas personales, contribuciones sociales y estabilidad emocional, siendo su definición dinámica y condicional al contexto cultural, existencial y temporal. Recomiendo evaluaciones periodales por parte de expertos en desarrollo humano."
es_exito,¿Cómo defines el éxito en la vida? ¿Crees que la definición cambia con la edad o las circunstancias?,"La definición del éxito puede categorizarse en tres modelos: éxito material (estatus económico, propiedades), éxito social (aceptación, influencia) y éxito personal (auto-realización, propósito). Este documento concluye que el concepto dinámico (conforme al contexto individual y cultural) permite flexibilización entre estos criterios. La literatura sustenta la suposición de que el éxito se define de forma ambigua con el envejecimiento y los ajustes en prioridades."
es_exito,¿Cómo defines el éxito en la vida? ¿Crees que la definición cambia con la edad o las circunstancias?,"Este tema ha sido estudiado en diversos marcos teóricos como el modelo de evaluación del éxito definido en (Hattie & Fisher, 2007). Con base en categorías como logros personales, sociales y financiers, se observa una fluctuación en la percepción del éxito conforme aumenta la edad. El marco de referencia aplicable establece que el éxito puede ajustarse de forma contextual y cultural, lo cual resalta necesidad de una interpretación dinámica. (Documento de referencia: Evaluaciones Multidimensionales de Logros Humanos)."
es_exito,¿Cómo defines el éxito en la vida? ¿Crees que la definición cambia con la edad o las circunstancias?,"Respecto a la definición del éxito, la Organización para la Cooperación y el Desarrollo Económico (OECD, 2021) ha categorizado el éxito como un constructo multifacético que incorpora componentes como realización personal, bienestar y contribución social. Este estudio también subraya que la interpretación del éxito puede variar según etapas de vida, contexto cultural y metas personales. Por consiguiente, se propone un marco de evaluación dinámico integrando factores socioeconómicos, psicológicos y étiicos que eviten un estereotipo unidimensional del éxito."
es_exito,¿Cómo defines el éxito en la vida? ¿Crees que la definición cambia con la edad o las circunstancias?,"El éxito se puede operacionalizar como la realización de metas definidas y el logro de metas que cumplen con criterios de valor y bienestar (por ejemplo, los indicadores de la Teoría del Desarrollo Personal según la Clasificación de la Organización de las Naciones Unidas para la Promoción de la Salud). Sin embargo, este criterio subjetivo varía según la perspectiva cultural y los contextos individuales, lo cual exige un enfoque multifacético. Por lo tanto, la definición de éxito puede ser dinámica y adaptativa a factores como las metas personales y las responsabilidades sociales."
es_exito,¿Cómo defines el éxito en la vida? ¿Crees que la definición cambia con la edad o las circunstancias?,"Este tema se aborda en el Informe Estándar de Autoevaluación de la Organización Individual de Desarrollo (OID). Establece que el éxito puede ser definido multifacético, con dimensiones económicas, emocionales y sociales. La variabilidad de dicha definición se explica por el proceso de madurez psicosocial y contextuales dinámicas sociales. El estándar sugiere una evaluación individualizada y flexible, adaptándose a criterios de bienestar total."
es_exito,¿Cómo defines el éxito en la vida? ¿Crees que la definición cambia con la edad o las circunstancias?,"Este tema ha sido discutido en la literatura filosófica y psicológica. Según la definición operativa del éxito incluida en los Estudios sobre Bienestar Humano de la OMS (2018), el éxito se puede medir por indicadores objetivos como logro financiero y social, así como por indicadores subjetivos como satisfacción personal. La evidencia empírica sugiere que la percepción del éxito varía en función de las expectativas culturales, metas personales y factores psicosociales. Recomendación: el enfoque integral se considera más efectivo para adaptación a la dinámica de cambios."
es_exito,¿Cómo defines el éxito en la vida? ¿Crees que la definición cambia con la edad o las circunstancias?,"El éxito puede definirse en múltiples dimensiones: como logro personal o profesional, bienestar psicosocial, estabilidad económica, y realización personal. Este concepto varía considerando culturalidades, valores individuales y contextuales. Según el modelo de éxito operativo (MOSA, 2013), la redefinición del éxito se observa con el envejecimiento asociado a prioridades en salud, familia y felicidad, contraposición a metas de progreso economico. La literatura recomienda una evaluación flexible según metas adaptativas personalizables."
es_tecnologia_conexiones,"Las redes sociales nos conectan con más personas que nunca, pero muchos se sienten más aislados. ¿A qué crees que se debe esta paradoja?","La paradoja referida se puede explicar desde múltiples perspectivas interrelacionadas: 

1. **Conexión superficial vs. conexión profunda**: Las redes sociales facilitan contactos institucionales, pero limitan profundidad psicosocial y empatía. 
2. **Conformidad social y presión de estandarización**: La participación excesiva induce dependencia mediática, afectando la salud psicológica individual. 
3. **Crisis de identidad y anclaje social**: La globalización digital promueve la pérdida de identidad auténtica y estabilidad social. 
4. **Carga emocional no manejable**: Aunque conectan a más personas, la falta de apoyo real en entornos virtuales exacerbada el aislamiento emocional. 

Los marcos teóricos inclusivos (teoría de la pertenencia social, efectos de la tecnología en salud mental) sugieren necesidad de políticas públicas que equilibren conexión digital con bienestar integral."
es_tecnologia_conexiones,"Las redes sociales nos conectan con más personas que nunca, pero muchos se sienten más aislados. ¿A qué crees que se debe esta paradoja?","Este fenómeno —la paradoja de la conexión digital aislada— puede atribuirse a un desequilibrio entre cantidad de interacciones y calidad. La dependencia en redes sociales puede sustituir interacciones cara a cara, limitando la empatía y el sentido de comunidad. Además, el consumo excesivo de contenido social puede inducir ansiedad o ansiedad social. Estos factores se pueden gestionar promoviendo estrategias para equilibrar la presencia en línea con momentos de conexión real, y fomentar espacios de interacción significativa."
es_tecnologia_conexiones,"Las redes sociales nos conectan con más personas que nunca, pero muchos se sienten más aislados. ¿A qué crees que se debe esta paradoja?","Este fenómeno puede explicarse mediante múltiples factores interrelacionados, incluyendo pero no limitados a: a) el cambio en las dinámicas de comunicación (interacciones superficiales vs. profundas), b) el efecto de la sobreexposición a información negativa, c) la desconexión afectiva por el uso excesivo, d) la pérdida de habilidades sociales por sustitución digital, y e) la variabilidad individual en el uso y percepción de las redes. Se recomienda un marco interdisciplinario para mayor profundidad."
